{"actions":["extract"],"deterministic":true,"distribution":"operator-built-oci-image","enforced_axes":{"cpu":true,"decompression":true,"environment":true,"filesystem":true,"input_bytes":true,"memory":true,"network":true,"open_files":true,"output_bytes":true,"process":true,"process_tree":true,"records":true,"recursion":true,"temporary_storage":true,"user_permissions":true,"wall_time":true},"enforcement_profile":"oci-docker-v1","formats":["image/x-portable-graymap"],"license_spdx":"Apache-2.0 AND PSF-2.0","network_mode":"disabled","platforms":["linux-container"],"protocol_version":"0.2","provider_id":"org.aecctx.vision.raster-rules","provider_version":"0.3.0","runtime_digest":"sha256:fd95fa221297a88e1cf49c55ec1828edd7c5a428187e67b5d1805692d11588db","runtime_version":"python-3.12.10-stdlib-raster-rules-v1"}
