{
  "actions": ["describe", "extract", "finalize"],
  "deterministic": true,
  "distribution": "bundled-reference",
  "enforced_axes": {
    "cpu": true,
    "decompression": true,
    "environment": true,
    "filesystem": true,
    "input_bytes": true,
    "memory": true,
    "network": true,
    "open_files": true,
    "output_bytes": true,
    "process": true,
    "process_tree": true,
    "records": true,
    "recursion": true,
    "temporary_storage": true,
    "user_permissions": true,
    "wall_time": true
  },
  "enforcement_profile": "oci-docker-v1",
  "formats": ["application/x-aecctx-provider-fixture"],
  "license_spdx": "Apache-2.0",
  "network_mode": "disabled",
  "platforms": ["linux-container"],
  "protocol_version": "0.2",
  "provider_id": "org.aecctx.reference-provider",
  "provider_version": "0.2.0",
  "runtime_digest": "sha256:6d43704baacd1bfbe7c295d7f13079d5d8104ed33568873133f8fc69980419df",
  "runtime_version": "python-3.12"
}
